blog_code,user_id,post_num,key,board_url,title,content,board_category,nickname,date
DM,hbj122,12,DM_hbj122_12,http://blog.daum.net/_blog/BlogTypeView.do?blogid=0Svbj&articleno=12&categoryId=0®dt=20131023170549,                [스크랩]                에스프레소 머신의 역사,에스프레소 머신의 역사 글 / 한 창 환 www.coffeetong.com,전체 목록,ε♡з천バド、,20131023
DM,hbj122,9,DM_hbj122_9,http://blog.daum.net/_blog/BlogTypeView.do?blogid=0Svbj&articleno=9&categoryId=0®dt=20130523082911,                [스크랩]                [33] 뉴거버넌스의 종류,1. 논의의 맥락 : 새로운 국정운영방식의 등장 1)개념 : 공동체 운영을 위한 새로운 국정운영 방식 2)UNDP의 개념 ①다양한 참여자들(Actors) ②참여자간 상호작용 과정(Process) ③그 산물인 조직(Organizat...                                                                                                                출처 : Cool Homo-Economicus with warm Heart                | 글쓴이 :                                    돌                                |                                    원글보기댓글1,전체 목록,ε♡з천バド、,20130523
DM,hbj122,7,DM_hbj122_7,http://blog.daum.net/_blog/BlogTypeView.do?blogid=0Svbj&articleno=7&categoryId=0®dt=20101103024235,                [스크랩]                Coleridge의 시와 상상력 이론을 통한 인간교육,"2008/05/26 04:01[=] Coleridge의 시와 상상력 이론을 통한 인간교육2008/05/26 04:01 in 퍼온~사유..!/사유와 상상. 목 차Ⅰ. 서론Ⅱ. ""The Ancient Mariner""에 나타난 인간교육Ⅲ. Coleridge의 상상력 이론을 통한 인간교육Ⅳ. 결론--------------------------------------------------------------------------------발행자명 나사렛대학교출판사 학술지명 지성과 창조 ISSN  권  호 4 출판일 2001.  Coleridge의 시와 상상력 이론을 통한 인간교육양현철2-405-0101-09국문요약낭만주의 시인들은 상상력을 통하여 현실을 초월하여 vision의 세계로 나아간다는 점에서 상상력은 역동적이고 창조적이다. 상상력은 고대 중세의 철학사상에 그 뿌리를 두고 영국 경험론 철학과 독일 관념론 철학에서 밀접한 연관성을 찾아볼 수 있다. 경험론 철학자 Bacon은 역사를 기억에 관한 학문으로 보고 시를 상상력에 관한 학문으로, 철학은 이성에 관한 학문으로 보고 있으며 상상력의 소산인 시는 현실의 사건보다 더 위대한 것을 생각해내며 역사보다 더욱 자유롭고 변화에 넘쳐 있으며 인간의 도덕성을 회복시켜 주고 인간을 지적 정서적으로 교육시켜 준다고 본다.Hume 철학은 상상력이 단순관념을 임으로 분리하고 결합시켜 관념을 구성한다고 하는 것이다. 이러한 작용을 가능케 하는 것은 연상법칙에 의한 것이며 Hartley에 의해 연상심리학이 확립된다. Hartley는 관념연합의 힘으로써 상상력의 존재를 인식하고 상상 속에 창조적 기능을 부여하게 된다.Coleridge의 상상력 이론은 『The Ancient Mariner』에 잘 드러나 있으며 Mariner를 통해 인간정신의 순화 및 도덕성 회복이라는 교육적인 면이 잘 묘사되어 있고 이 시의 구조 속에서는 인간이 지혜를 얻게 되는 과정에서 인간의 죄와 인간의 죄를 씻어줄 수 있는 자연과의 상호관계가 잘 융화되고 있다.--------------------------------------------------------------------------------Ⅰ. 서론낭만주의 시인들은 상상력에 대해 특별한 견해와 중요성을 부여한다. 그들에 의하면 현실세계에서 그 현실을 초월하는 vision의 세계로 인도해 주는 창조적이고 직관적인 능력이 상상력이다. 물론, 낭만주의 시인들이 각기 주장하는 상상력의 개념과 이것이 시에 미치는 영향에 대한 견해가 조금씩은 다르지만 상상력이 인간의 이상적인 삶의 형태인 순수의 세계, 영원의 세계로 인도해 주는 능력이라는 데는 공통적이다. 그리고 이런 상상력은 인간의 내면적인 세계에서 발휘된다.이러한 상상력에 대한 이론을 정립하는 데 우선 낭만주의 시인들은 인간 자신에 대한 믿음과 권위를 회복시키고자 하였다. 따라서 이들은 신 중심적인 가치관에서 인간 중심적인 가치관으로 전환하였다. 또 세계관에 있어서도 ‘The Great Chain of Being’의 개념에서 연유된 'static mechanism'에서 성장과 변화, 유동성을 중요시하는 'dynamic organism'으로 바뀌어져 인간의 내면적인 성숙의 과정이 중요시되었다. 그러므로 분명한 것은 베이트 W.T. Bate의 말대로 상상력을 ""combination of innate sensibility, the power of association, and the faculty of conception’’ (Rene Welleck 179)이라고 생각하였던 Hume과 다른 18세기 문학이론가들의 정적인(static) 견해와 낭만주의 시인들의 동적인(dynamic) 견해가 다르다는 것이다. 낭만파 시인들에게 있어 상상력이란 역동적(dynamic)이고 창조적인 것이다.Coleridge는 상상력의 개념에 대한 정의를 자신의 저서인 Biographia Literaria, 13장에서 다음과 같이 묘사하고 있다.The imagination… I consider either as primary, or secondary.The primary imagination I hold to be the as a repetition in the finite mind of the eternal act of creation in the infinite I AM. The secondary I consider as an echo of the former, co-existing with the conscious will, yet still as identical with he primary in the kind of its agency, and differing only in degree, and I the mode of its operation. It dissolves, diffuses, dissipates, in order to recreate; or where this process is rendered impossible, yet still, at all events, it struggles to idealize and to unify. It is essentially vital, even as all objects (as objects) are essentially fixed and dead. (Biographia Literaria 202)18세기 후반 영국의 문예 비평 정신은 점차 Aristotle에서 유래하는 모방설에서 벗어나 독창성을 존중하는 경향을 띠게 되면서 비평 속에 'fancy, invention, originality, imagination'등의 어휘를 많이 사용하였다. 그럼에도 상상력이란 확고한 사상은 찾아볼 수 없었다. 그런데 근세 문예 비평의 역사는 철학사상의 영향아래서 발전되었다. 콜리쥐(Coleridge)에 의하여 확립된 상상력 이론은 철학과 더욱 굳게 결부되어 있다. 이러한 상상력 이론은 고대와 중세의 철학사상, 특히 Plotinus의 유일 사상인 Hebrew신학에서 유래되는 천지창조의 사상과 깊은 관련이 있으면서 Bacon이후 John Locke, David Hume, David Hartley등에 의한 영국 경험론 철학, Kant, Schelling, Schlegel등 독일 관념론 철학과 밀접한 관계가 있다. 여기서는 영국 근세 철학과 상상력사상에 관하여 살펴보겠다.먼저 지각의 우위를 주장하는 경험론 철학자 F. Bacon(1561-1626)을 보면 그는 상상력에 중점을 두지 않았다. 그러나 지각과 함께 상상력의 존재를 인정하고 있으며 그 성질에 대해 고찰하고 있다. 그는 The advancement of Learning(1650) 제2권에서 학문을 역사, 시, 철학으로 나누고 역사를 기억에 관한 학문으로, 시를 상상력에 관한 학문으로, 철학은 이성에 관한 학문으로 여기고 있다. Bacon은 그의 저서에서 상상력이란 물질의 법칙에 속박 당하지 않고 자유자재로 자연이 분리한 것을 결합하고 자연이 결합한 것을 분류하는 능력이라고 하였다(Francis Bacon 82). 이 같은 상상력의 소산인 시는 현실의 사건보다 더 위대한 것을 생각해내며 역사보다 더욱 자유롭고 변화에 넘쳐 있으며 인간의 도덕성을 회복시켜 주며 인간을 지적 정서적으로 교육시켜준다. 아울러 상상력은 이성이나 오성에 선행하고 의지에 선행하는 독립된 능력이라 하였다. 이 같은 Bacon의 원리는 상상력 사상의 하나의 초석을 마련하였다.영국의 근세 철학의 집성자 David Hume(1711-1776)은 인간의 모든 정신현상으로서의 Perception을 Impression과 Idea로 분류하였다. 그런데 전자가 ‘Sensation, Passion, Emotion’등 외계로부터 직접 주어지는 것이라면, 후자는 이들이 사고나 추리로 정신에 어렴풋이 떠오르는 인상으로부터 복사되는 것으로 이차적인 것이라 하였다. Coleridge가 Impression이나 Idea라는 말을 사용할 때 그 의미를 Hume의 이 같은 의미에서 따왔다고 보는 것이 일반적인 견해인데, Hume에 의하면 관념상기의 방법에는 기억(memory)에 의한 것과 Imagination에 의한 것 두 가지 종류가 있다. 여기서 기억이란 이미 받아들인 인상을 반복하는 기능이며 Imagination과 같은 종류의 기능이지만 관념으로 상기한다는 점에 있어서 다르다. 반면 Imagination은 반복에 의한 것이 아니다. 기억은 인상이나 단순관념을 있는 대로 그 순서나 위치를 바꾸지않고 반복하는데 반해 Imagination은 모든 단순관념을 임의로 분리하고 결합시키는 것이다. 그런데 이런 재결합을 가능하게 하는 것이 연상의 법칙이다. 아울러 Hume에 있어서 정신활동의 지적인 모든 것을 나타내는 지성은 이성과 열정의 양면을 포함하고 있는데 상상력은 이성의 범주를 넘어 관념을 구성하는 작용을 한다. 상상력에 이 같은 구상의 능력을 부여한 것이 Hume철학의 장점이다.David Hartley는 Hume의 연상에 대한 생각을 보다 깊이 탐구하여 특색 있는 연상심리학을 확립하였다. Hartley의 연상심리학의 요점은 다음과 같다. 우리의 지식은 Sensation이나 외부로부터의 인상을 연상 능력에 의해 재결합함으로 얻을 수 있다. 그 감각이나 인상은 'intellectual intercourse'에 의해 결합된다. 그리고 지적교류라 하는 것은 물질의 연상(extension), 움직임(motion), 속도(degree of velocity)의 결합으로 그것에 의해 개념(notion)을 얻게 된다. Hartley는 관념의 구성을 동시성이라고 하는 자주성이 없는 원리에 의해 해석하고 상상력이란 것도 단순히 관념의 공존을 촉진하는 연상작용에 지나지 않는 것이라 생각하였다. 이점에 관해 Hartley는 다음과 같이 말한다.The recurrence of ideas, especially visible and audible ones, in a vivid manner, but without any regard to order observed in past facts is ascribed to the power of imagination and Fancy (David Hartley 383)이같이 하트레이(Hartley)에서 상상력은 인식이나 사고의 매개물이자 ‘intermediate power'로서 관념재현의 능력이긴 하지만 결국 Lock나 Hume의 경험철학을 바탕으로 기계론적 물질주의 사상에 멈추고 말았다. 때문에 Wordsworth나 Coleridge가 한때 이런 Hartley의 철학에 몰두해 있었지만 그 기계론적 물질주의에 아쉬움을 느껴 주관의 힘을 더 강하게 인식하고서 자아의 능동성을 주장하는 Kant등의 독일 철학쪽으로 돌아서게 된 것이다. 여하튼 Hartley는 관념연합의 힘으로써 상상력의 존재를 인식하고 그 힘의 작용에 관해 약간의 고찰을 하였다는 점에서 후세의 상상력 설에 기여했다고 할 수 있다.이러한 상상력에 대한 이론을 정립하는데 있어 우선 낭만주의 시인들은 인간 자신에 대한 믿음과 권위를 회복시키고자 하였다. 따라서 이들은 신 중심적인 가치관에서 인간 중심적인 가치관으로 전환하였다. 또 세계관에 있어서도 ‘The Great Chain of Being’의 개념에서 연유된 static mechanism에서 성장과 변화, 유동성을 중요시하는 dynamic organism으로 바뀌어져 인간의 내면적인 성숙의 과정이 중요시되고 인간교육에 중점을 두었다.Coleridge는 최초로 상상력이라는 막연한 개념을 이론화하고 상상력의 개념을 문학이론의 중심부로 끌어들였다는 점에서 그의 의의가 있다. Coleridge의 상상력 개념은 철학을 바탕으로 한 문학적인 사유로서, Coleridge자신이 문학이론 혹은 실제적인 시 창작에서 문제삼았던 모든 issue가 바로 이 상상력이라는 개념으로 귀결된다. 그는 이러한 문학적 상상력을 통하여 자신의 시 ""The Ancient Mariner""에서 인간 정신의 순화 및 도덕성 회복이라는 인간 교육적인 면을 잘 서술해주고 있다.Ⅱ. ""The Ancient Mariner""에 나타난 인간교육""The Ancient Mariner""는 epic으로 간주되기도 하나 전체가 7부로 된 소박한 구어체의 Ballad로 되어 있다. 이 시속에서 화자의 역할이 두드러지며 시에 나타난 전체의 설화는 공간적으로 멀리 떨어진 신비적 세계로서 낭만시의 특색을 잘 보여주고 있다. 시가 시작되기 전에 나오는 epigraph는 다음과 같은 의미를 지니고 있다고 Barth는 말하고 있다.We are warned even before we start that this is a poem about worlds too vast to be fully conquered, about mysteries too deep to be encompassed by mere worlds and yet about the need to try to conquer them. to encompass them a poem, therefore, of symbolic weight and import!. (J. Rober Barth 91)Barth는 이 시가 너무 광대하고 깊은 신비세계를 다루고 있어 단지 언어로서는 명백히 이해하기 어렵다는 것을 경고해주고 있다. 그러나 Coleridge는 이 epigraph를 통하여 인간의 정신이 상상의 세계의 경험을 통하여 사물을 보는 관점, 즉 상상력을 얻게 됨을 암시해 주고 있다. 따라서 Coleridge는 이 시에서 주제를 죄를 짓고 벌을 받는 가운데 뉘우치고 화해에 이르게 되는 과정을 상상력을 통한 인간교육의 장으로서 전개시키고 있다. John S. Hill도 이 시에 대해 다음과 같이 언급하고 있다.""the poem is 'about' the orthodox Christian progression from sin and the recognition of sin, through repentance and punishment to such redemption as is possible in this world: (John Spencer Hill 155)그러나 Barbauld는 이 시의 비현실성과 도덕성의 결핍에 대해서 불평하고 있다. 이에 대하여 Coleridge는 이 시의 비현실성은 인정하겠으나 도덕성의 결핍에 있어서는 오히려 이시는 'pure imagination'을 통하여 작품 속에서 도덕적 감정을 회복시켜 주는 인간에 대한 교육적인 측면이 강조되고 있다고 지적하였다(H.N. Coleridge 106). 또한 Richard Haven은 알 수 없는 'supernatural world'를 독자도 경험할 수 있는 가능성이 있다며 이 시의 특징에 대해 다음과 같이 이야기하고 있다.""We are made to share the Mariner's experiences to such degree that we are forces to acknowledge its reality, to realize that in form and quality if not in circumstances, what happened to him may happen to us-the possibilities of experiences"" (Richard Haven 107)""The Ancient Mariner""에서 'imagination' 이라는 주제와 관련하여 도덕적으로 경험 가능한 세계를 정당화시키고자 Coleridge는 여러 가지 시적 기교를 어떻게 사용하고 있는지 살펴보겠다.외로운 방랑자인 Ancient Mariner는 제 1부에서 결혼식장의 하객중 한사람을 붙들고 자기의 기이한 경험담을 들려주기 시작한다. 그는 Albatross라는 길조를 죽이고 난 후 남해와 태평양에서 겪었던 끔찍스런 일을 다 이야기하고 나서야 풀어주는 초자연적인 공포와 신비의 이야기이다. 그 이야기의 리듬은 듣는 사람을 매혹시켜 꼼짝 못하게 하는 마력을 지니고 있다.폭풍우가 몰아침으로 배가 생물 없는 얼음의 나라로 밀려가는 도중에 길조의 새인 Albatross를 Ancient Mariner가 무심코 죽인 것이 이 이야기의 줄거리이다. 그가 Albatross를 살인한 행위는 ""The ancient Mariner inhospitably killeth the pious bird of good omen""라고 묘사된다. 그의 죄는 새가 하나의 'christian soul'로 정의되면서부터 상징적으로 성립되고 있다.At length did cross an Albatross, Thorough the fog it came; As if it had been a Christian soul, We hailed it in God's name. (The Ancient Mariner 63-6)비록 Mariner가 새를 살해한 뚜렷한 동기는 없지만 그가 새를 살해했다는 것은 ‘hospitality and sanctity’의 모독으로 간주되기 때문에 그는 살인자로서의 죄를 지니게 된다. 또 한편으로 이는 인간의 의지에서 기인되는 원죄의 재현으로 간주되기도 한다.제 5부에서 Spirit 중의 하나가 그 새는 ""loved the man, who killed it""라고 말함으로써 hospitality and sanctity'의 모독이라는 점이 다시 강조되고 있다. 이것은 또한 imagination의 주제면에서 본다면 Mariner가 Albatross를 죽인 것이 상상력에 대한 죄가 되는 것이라고 와렌(R.P. Warren)은 주장하고 있다.At the level of the secondary theme it is, of course a crime against the imagination. Here, in the crime the two themes are fused (Robert Penn Warren 239)이러한 지적은 이 시의 주제를 살펴봄으로써 더욱 뚜렷하게 드러난다. 앞에서도 언급하였지만 많은 비평에서 말하는 이 시의 주제는 두 가지 측면에서 볼 수 있다. 즉 primary theme으로서는 'guilt, punishment and redemption'이라는 인간교육을 들 수 있고, secondary theme으로는 ‘imagination과 예술가의 vision’을 들 수 있다.R.P. Warren은 이 두 주제에 대하여 더욱 분명하게 정의하고 있다. 그는 primary 혹은 moral theme으로서 기독교적 성찬식의 의식으로 해석하는 sacramental vision과 secondary 혹은 aesthetic theme으로 Mariner의 'crime, punishment and reconciliation'에 관한 이야기로 보여지는 ‘One Life’로 정의한다(233-50). 이 시에서 Mariner는 어떠한 동기도 없이 그들에게 혜택을 주는 새를 죽이고는 모든 생명체와 인간과의 유대감을 잃게 된다. 그 결과 그는 극심한 고독과 'death-in-life'의 상황에 빠지게 되며 여기에서 심한 고통을 겪다가 자신도 모르는 사이에 미물인 water-snakes를 축복하게 된다. 그래서 다시 삶을 얻어 고향에 돌아오는데 그는 이 같은 자신의 경험을 통하여 ""He prayeth best, who loveth best""라는 moral을 말하여 준다. 그가 이렇게 말할 때 독자들은 여기에서 'Universal charity'의 개념에 이르게 된다.For the dear God who loveth us, ""He made and loveth all, the Mariner, whose eye is bright, Whose beard with age is hoar, (The Ancient Mariner 615-9)Coleridge는 이 시에 Albatross, water-snakes 그리고 Polar Spirit을 상징적으로 사용하고 있다. 또한 Fall-Redemption theme과 Imagination theme에 관련지어진 'the sun, the moon, stars'들도 초자연적인 요소이다. 그는 시에 자신의 표현의 매개물로서 혹은 상징으로서 초자연적인 것들을 많이 사용하고 있다. 그는 독자로 하여금 시속에 나타난 가공적 인물들이나 사건들의 내적 존재의 진실을 인식하도록 이러한 상징적 수법을 사용한 것이다. 이와 같은 외적 사건들과 물리적 현상들은 내적 진실과 초자연적 존재의 상징으로 시에 잘 묘사하고 있다. 예를 들면, 이 시의 지배적인 Symbol로 사용되는 sun과 moon을 볼 때 sun의 빛 아래에서는 나쁜 사건들이 일어나고 moon의 빛 아래에서는 좋은 사건들이 일어난다. 그리고 moonlight은 Imagination의 색채로서 기능하고 시의 뒤에 나오는 wind와 storm은 vitality와 creative force의 상징으로 나타나고 있다. 이들 상징에 대하여 각각을 구체적으로 살펴보면 다음과 같다.Coleridge는 시의 시작에서부터 sun이 나타내어 주는 logical world와 moonlight가 나타내멀티미디어는 표시되지 않습니다.",전체 목록,ε♡з천バド、,20101103
DM,hbj122,6,DM_hbj122_6,http://blog.daum.net/_blog/BlogTypeView.do?blogid=0Svbj&articleno=6&categoryId=0®dt=20100930000111,                [스크랩]                맥베스 독후감상문,"2007년 10월 10일 맥베스를 읽고... 처음 이 책을 받았을 때에는 책도 얇고 연극 대본 같아 읽기도 쉬울 것이라는 막연한 생각 뿐이였다. 그런데 책이 얇아 읽는데 시간은 그리 오래 걸리지 않았지만 내용이 이해가 잘 않되었었다. 2번 정도 읽었을 때야 내용 파악이 되었고, 3번을 읽고 나니 무엇을 말하고자 했었는지 조금은 알 것 같았다. 맥베스의 내용은 이러하다. 장차 왕이 될 운명을 타고났다는 세 마녀의 예언을 듣고 맥베스는 덩컨왕을 살해하고 마침내 왕위를 빼앗는다. 왕위에 오른 맥베스는 의심나는 신하를 차례로 죽여 가며 피비린내 나는 폭정을 펴다가, 마침내는 반정군에게 죽음을 당하면서 마무리된다. 내용에서 맥베스가 왜 그리 될 수밖에 없었는지를 난 생각해 보았다. 첫 번째로 내가 생각하기에 맥베스의 부인 때문인 것 같았다. 맥베스의 부인은 맥베스와 달리 처음부터 군력에 대한 욕심이 많았다. 맥베스가 마녀의 유혹을 받고도 한동안은 이성과 욕망 사이에서 갈등하였던데 반해 맥베스 부인은 기다렸다는 듯이 대담하고 잔인하며 결단력 있는 행동으로 맥베스가 결단을 내리도록 도왔다. 그러나 처음에는 군력을 위해 부인이 그리 했지만 나중에는 맥베스 자신 스스로가 죄책감도 느끼지 못하도록 변한다. 두 번째로 마녀의 예언과 또 부인의 설득을 당하는 것을 보아 맥베스는 자립된 인물이 아닌 것이 이유인 듯 했다. 처음의 덩컨왕을 살해한 것도 그의 아내의 말에 의지해 저지른 것이고, 또 마지막에 마녀의 예언에 의해 싸우나 맥더프의 진실일지 아닐지도 모르는 말에 흔들려 용기를 잃는 맥베스는 결국 불행한 최후를 당한 것이라 생각했다. 이 책을 읽고 나는 맥베스라는 인물은 우리 자신의 모습일거라는 생각이 들었다. 선하고 올바른 동기에서는 주저함이 없이 용감하지만 잘 못된 동기인 것을 알면서도 악행을 행할 때는 주저하고 괴로워하고, 고통 받는 모습이 지금 현재의 인간의 모습 같았다. 선하고 올바른 동기일지라도 주저하고, 악행을 할지라도 용감할 때가 있는데 어떤 모습이 세상을 살아갈 때 필요한 모습인지 다시 한 번 생각해 보게 됐다. 또 하나는 인간의 욕심은 끝이 없다는 것이다. 하나의 욕심을 채우면 또 다른 욕심을 불러오는 것처럼 그릇된 욕망을 이루려다가 죄를 저지르게 되고, 그 이후에는 더욱 욕망의 노예가 되어 또 다시 죄를 저지르지만 결국에는 망한다는 것 또한 이 책에서 말하고자 했던 것이며, 내가 느낀 점도 바로 이 점이다.                 출처 : 평화바다의 자료창고                | 글쓴이 :                                    평화바다                                |                                    원글보기댓글쓰기",전체 목록,ε♡з천バド、,20100930
